{
  "record_type": "world_pack_runtime_profile",
  "schema_version": "1.0",
  "profile_id": "worldpack-runtime:tbc243:razorfen:v2",
  "pack_directory_name": "tbc243-razorfen-v2",
  "pack_id": "wow.tbc.2.4.3.8606.razorfen-worldpack-v2",
  "content_sha256": "8014951207d52e21dc186af6b05326f6d03b70703bf71c4185e4266983743fbd",
  "catalog_id": "wow.tbc.2.4.3.8606.razorfen-v2",
  "target_profile": "tbc_243_lab",
  "client_version": "2.4.3",
  "client_build": "2.4.3.8606",
  "nav_profile_id": "tbc243-razorfen-v2",
  "maps": [
    {
      "map_id": 47,
      "internal_name": "RazorfenKraulInstance"
    }
  ],
  "execution_authority": false
}
