{
  "record_type": "world_pack_runtime_profile",
  "schema_version": "1.0",
  "profile_id": "worldpack-runtime:tbc243:proof:v3",
  "pack_directory_name": "tbc243-8606-proof-worldpack-v3",
  "pack_id": "wow.tbc.2.4.3.8606.proof-worldpack-v3",
  "content_sha256": "33bbbba1ef9f698cd1e843c7ca463a069e78dd27339a28f57715669a00b03363",
  "catalog_id": "wow.tbc.2.4.3.8606.client-world-v1",
  "target_profile": "tbc_243_lab",
  "client_version": "2.4.3",
  "client_build": "2.4.3.8606",
  "nav_profile_id": "tbc243-proof-v2",
  "maps": [
    { "map_id": 47, "internal_name": "RazorfenKraulInstance" },
    { "map_id": 532, "internal_name": "Karazahn" }
  ],
  "execution_authority": false
}
