{
  "record_type": "world_pack_runtime_profile",
  "schema_version": "1.0",
  "profile_id": "worldpack-runtime:tbc243:monastery:candidate-v1",
  "pack_directory_name": "tbc243-monastery-candidate-v1",
  "pack_id": "wow.tbc.2.4.3.8606.monastery-candidate-v1",
  "content_sha256": "621055111208d0887cacba01db9419d7ac5b30402006e44fb27df2a6e677d2f7",
  "catalog_id": "wow.tbc.2.4.3.8606.monastery-candidate-v1",
  "target_profile": "tbc_243_lab",
  "client_version": "2.4.3",
  "client_build": "2.4.3.8606",
  "nav_profile_id": "tbc243-monastery-candidate-v1",
  "maps": [
    { "map_id": 189, "internal_name": "MonasteryInstances" }
  ],
  "execution_authority": false
}
