{
  "record_type": "world_pack_runtime_profile",
  "schema_version": "1.0",
  "profile_id": "worldpack-runtime:tbc243:deadmines-candidate:v3b",
  "pack_directory_name": "tbc243-deadmines-candidate-v3b",
  "pack_id": "wow.tbc.2.4.3.8606.deadmines-candidate-v3b",
  "content_sha256": "470b324c425bff9ed638ff43cd44d87271ab8d30b2f32493a0b379f0e976a69a",
  "catalog_id": "wow.tbc.2.4.3.8606.deadmines-candidate-v3",
  "target_profile": "tbc_243_lab",
  "client_version": "2.4.3",
  "client_build": "2.4.3.8606",
  "nav_profile_id": "tbc243-full-v3-candidate",
  "maps": [
    {
      "map_id": 36,
      "internal_name": "DeadminesInstance"
    }
  ],
  "execution_authority": false
}
