{
  "record_type": "world_pack_runtime_profile",
  "schema_version": "1.0",
  "profile_id": "worldpack-runtime:tbc243:stratholme:candidate-v1",
  "pack_directory_name": "tbc243-stratholme-candidate-v1",
  "pack_id": "wow.tbc.2.4.3.8606.stratholme-candidate-v1",
  "content_sha256": "3e441648de567d3b16e9b9d6b000135b70a5ceef944d93dd1c815bc98e666f50",
  "catalog_id": "wow.tbc.2.4.3.8606.stratholme-candidate-v1",
  "target_profile": "tbc_243_lab",
  "client_version": "2.4.3",
  "client_build": "2.4.3.8606",
  "nav_profile_id": "tbc243-stratholme-candidate-v1",
  "maps": [
    { "map_id": 329, "internal_name": "Stratholme" }
  ],
  "execution_authority": false
}
