{
  "record_type": "world_pack_runtime_profile",
  "schema_version": "1.0",
  "profile_id": "worldpack-runtime:tbc243:world-continents:v1",
  "pack_directory_name": "tbc243-world-continents-v1",
  "pack_id": "wow.tbc.2.4.3.8606.world-continents-v1",
  "content_sha256": "d8a1b65e71602e6513b0d8e711001a23cdfc98ceb2109834ba8a86fa5ef689ac",
  "catalog_id": "wow.tbc.2.4.3.8606.world-continents-v1",
  "target_profile": "tbc_243_lab",
  "client_version": "2.4.3",
  "client_build": "2.4.3.8606",
  "nav_profile_id": "tbc243-world-continents-v1",
  "maps": [
    { "map_id": 0, "internal_name": "Azeroth" },
    { "map_id": 1, "internal_name": "Kalimdor" },
    { "map_id": 530, "internal_name": "Expansion01" }
  ],
  "execution_authority": false
}
