{
  "record_type": "world_pack_runtime_profile",
  "schema_version": "1.0",
  "profile_id": "worldpack-runtime:tbc243:kalimdor:v1-candidate",
  "pack_directory_name": "tbc243-kalimdor-v1-candidate",
  "pack_id": "tbc243-kalimdor-v1-candidate",
  "content_sha256": "609a20256ec154c98bd630091753a6229f610488536ec61b7ef0a5ca19c3db5f",
  "catalog_id": "wow.tbc.2.4.3.8606.kalimdor-v1",
  "target_profile": "tbc_243_lab",
  "client_version": "2.4.3",
  "client_build": "2.4.3.8606",
  "nav_profile_id": "tbc243-kalimdor-v1",
  "maps": [
    {
      "map_id": 1,
      "internal_name": "Kalimdor"
    }
  ],
  "execution_authority": false
}
