{
  "record_type": "world_pack_runtime_profile",
  "schema_version": "1.0",
  "profile_id": "worldpack-runtime:tbc243:shadowfang:v3-candidate",
  "pack_directory_name": "tbc243-shadowfang-v3-candidate",
  "pack_id": "tbc243-shadowfang-v3-candidate",
  "content_sha256": "e05f11385126f79496398239c3cdfc5439a7e374e1870632a1d869ca0ec986d7",
  "catalog_id": "wow.tbc.2.4.3.8606.shadowfang-v3",
  "target_profile": "tbc_243_lab",
  "client_version": "2.4.3",
  "client_build": "2.4.3.8606",
  "nav_profile_id": "tbc243-shadowfang-v3",
  "maps": [
    {
      "map_id": 33,
      "internal_name": "Shadowfang"
    }
  ],
  "execution_authority": false
}
