{
  "record_type": "world_pack_runtime_profile",
  "schema_version": "1.0",
  "profile_id": "worldpack-runtime:tbc243:shadowfang:v1",
  "pack_directory_name": "tbc243-shadowfang-worldpack-v1",
  "pack_id": "wow.tbc.2.4.3.8606.shadowfang-worldpack-v1",
  "content_sha256": "eaa1ac8cc14a1188041227af57ab5927b976a45500046721836a12bcb1a71a19",
  "catalog_id": "wow.tbc.2.4.3.8606.shadowfang-v2",
  "target_profile": "tbc_243_lab",
  "client_version": "2.4.3",
  "client_build": "2.4.3.8606",
  "nav_profile_id": "tbc243-shadowfang-v2",
  "maps": [
    { "map_id": 33, "internal_name": "Shadowfang" }
  ],
  "execution_authority": false
}
