{
  "record_type": "world_pack_runtime_profile",
  "schema_version": "1.0",
  "profile_id": "worldpack-runtime:tbc243:tirisfal:v2",
  "pack_directory_name": "tbc243-human-road-corridor-v6-worldpack-v2",
  "pack_id": "wow.tbc.2.4.3.8606.tirisfal-worldpack-v2",
  "content_sha256": "fd2eb93eccc75f5c297d5a17bab52bd9d2f96a9d0f5cfb87fdb6d655c3f35d30",
  "catalog_id": "wow.tbc.2.4.3.8606.client-world-v1",
  "target_profile": "tbc_243_lab",
  "client_version": "2.4.3",
  "client_build": "2.4.3.8606",
  "nav_profile_id": "tbc243-human-road-corridor-v6",
  "maps": [
    { "map_id": 0, "internal_name": "Azeroth" }
  ],
  "execution_authority": false
}
