{
  "record_type": "world_pack_runtime_profile",
  "schema_version": "1.0",
  "profile_id": "worldpack-runtime:tbc243:azeroth-full:v3",
  "pack_directory_name": "tbc243-azeroth-full-v3",
  "pack_id": "wow.tbc.2.4.3.8606.azeroth-full-worldpack-v3",
  "content_sha256": "a9feb578fea082f073effd84415977fa8a760ed2e5b2f8b07a1609215fe56b78",
  "catalog_id": "wow.tbc.2.4.3.8606.azeroth-full-v3",
  "target_profile": "tbc_243_lab",
  "client_version": "2.4.3",
  "client_build": "2.4.3.8606",
  "nav_profile_id": "tbc243-azeroth-full-v3",
  "maps": [
    { "map_id": 0, "internal_name": "Azeroth" }
  ],
  "execution_authority": false
}
